{
  "run_id": "RUN-E0-V1-001",
  "experiment_id": "E0",
  "dataset_version": "D0-FIXTURE-1.0.0",
  "system_id": "SUT-V1",
  "system_version": "1.0.0",
  "config_sha256": "bbbbbbbbbbbbbbbbbbbbbbbbbbbbbbbbbbbbbbbbbbbbbbbbbbbbbbbbbbbbbbbb",
  "environment_sha256": "cccccccccccccccccccccccccccccccccccccccccccccccccccccccccccccccc",
  "started_at": "2026-09-23T07:00:00Z",
  "finished_at": "2026-09-23T07:01:00Z",
  "status": "completed",
  "schema_version": "1.0.0"
}
